{
  "$schema": "https://json-schema.org/draft/2020-12/schema",
  "$id": "https://morphloop.dev/contracts/schemas/pack/v2/artifact-spec.json",
  "title": "Artifact spec",
  "description": "Something the learner can operate or view, embedded in a text block, a drill item or a chat message. 'type' names an Artifact subclass the app registers; it is not an enum, and an unregistered type is an import error. 'spec' is any object here: its shape is the 'spec_schema' of that type, validated by the importer (ADR-0018 section 19).",
  "type": "object",
  "required": [
    "id",
    "type",
    "labels",
    "spec"
  ],
  "properties": {
    "id": {
      "$ref": "https://morphloop.dev/contracts/schemas/common/ids.json#/$defs/definition_id"
    },
    "type": {
      "$ref": "https://morphloop.dev/contracts/schemas/common/ids.json#/$defs/token"
    },
    "labels": {
      "$ref": "https://morphloop.dev/contracts/schemas/pack/v2/defs.json#/$defs/labels"
    },
    "spec": {
      "type": "object"
    }
  },
  "additionalProperties": false
}
