{
  "id": "dns-resolution-flow",
  "type": "diagram",
  "labels": [
    "topic:network.dns.resolution"
  ],
  "spec": {
    "title": "How ledger.corp.internal becomes an address",
    "environment_bindings": {
      "service_name": "ledger.corp.internal",
      "service_port": 9093,
      "health_path": "/readyz"
    },
    "diagram": {
      "type": "sequence",
      "actors": [
        {
          "id": "app",
          "label": "Application (curl)"
        },
        {
          "id": "libc",
          "label": "libc getaddrinfo (stub resolver)"
        },
        {
          "id": "hosts",
          "label": "/etc/hosts"
        },
        {
          "id": "nameserver",
          "label": "Configured nameserver (UDP 53)"
        },
        {
          "id": "internet",
          "label": "Root, TLD and authoritative servers"
        }
      ],
      "steps": [
        {
          "id": "lookup-call",
          "from": "app",
          "to": "libc",
          "label": "getaddrinfo(\"ledger.corp.internal\")",
          "explanation": "The application never speaks DNS. It hands the name to the C library and waits for a list of addresses.",
          "reality": {
            "mechanism": "`curl` calls `getaddrinfo()` in libc. This lab runs Alpine, whose libc is musl: the lookup reads files and sends packets directly, with no NSS modules and no `/etc/nsswitch.conf` involvement.",
            "observe": [
              {
                "argv": [
                  "curl",
                  "-sv",
                  "--max-time",
                  "5",
                  "http://ledger.corp.internal:9093/readyz"
                ],
                "purpose": "See where the request stops: before or after the name is resolved.",
                "look_for": "`Could not resolve host` means the lookup failed; `Trying <address>:9093` means it succeeded."
              },
              {
                "argv": [
                  "getent",
                  "hosts",
                  "ledger.corp.internal"
                ],
                "purpose": "Run the same libc lookup the application uses, without HTTP.",
                "look_for": "An address line on success; no output and exit code 2 on failure."
              }
            ]
          }
        },
        {
          "id": "hosts-file",
          "from": "libc",
          "to": "hosts",
          "label": "Check local overrides first",
          "explanation": "`/etc/hosts` is consulted before any DNS query. A match here ends the lookup, so DNS is never asked.",
          "reality": {
            "mechanism": "musl opens and scans `/etc/hosts` line by line on every lookup; glibc does the same when `files` comes first on the `hosts:` line of `/etc/nsswitch.conf`.",
            "observe": [
              {
                "argv": [
                  "cat",
                  "/etc/hosts"
                ],
                "purpose": "See whether the name is pinned locally.",
                "look_for": "Any line containing the service name."
              },
              {
                "argv": [
                  "strace",
                  "-f",
                  "-e",
                  "trace=openat,sendto,connect",
                  "getent",
                  "hosts",
                  "ledger.corp.internal"
                ],
                "purpose": "Watch the lookup read its files and send its packets, as system calls.",
                "look_for": "`openat(... \"/etc/hosts\" ...)`, then `openat(... \"/etc/resolv.conf\" ...)`, then `sendto(...)` with `sin_port=htons(53)` and the destination address."
              }
            ],
            "artifacts": [
              {
                "kind": "file",
                "locator": "/etc/hosts",
                "description": "Static name-to-address overrides for this host only."
              }
            ]
          }
        },
        {
          "id": "dns-query",
          "from": "libc",
          "to": "nameserver",
          "label": "DNS query: A? ledger.corp.internal",
          "explanation": "With no local match, the stub resolver reads its configuration and sends a UDP query to port 53 of each configured nameserver.",
          "reality": {
            "mechanism": "The `nameserver` lines of `/etc/resolv.conf` decide the destination. musl sends the query to all listed servers in parallel and takes the first reply; `options timeout:` and `attempts:` bound how long it waits. An address with no DNS server behind it yields no reply at all.",
            "observe": [
              {
                "argv": [
                  "cat",
                  "/etc/resolv.conf"
                ],
                "purpose": "See which servers the stub resolver asks.",
                "look_for": "The `nameserver` lines and `options`."
              },
              {
                "argv": [
                  "dig",
                  "ledger.corp.internal"
                ],
                "purpose": "Send the same query by hand, to the same configured servers.",
                "look_for": "Error lines such as `no servers could be reached`, or the `SERVER:` line in the footer naming the server that answered."
              },
              {
                "argv": [
                  "tcpdump",
                  "-ni",
                  "any",
                  "-c",
                  "6",
                  "udp",
                  "port",
                  "53"
                ],
                "purpose": "Capture the query packets on the wire. Run a lookup in a second terminal while this waits.",
                "look_for": "`A? ledger.corp.internal.` going out, the destination address, and whether a reply comes back."
              }
            ],
            "artifacts": [
              {
                "kind": "file",
                "locator": "/etc/resolv.conf",
                "description": "Stub resolver configuration: nameservers, search domains, options."
              },
              {
                "kind": "packet",
                "locator": "udp/53 on any interface",
                "description": "The DNS query and reply packets."
              }
            ]
          }
        },
        {
          "id": "dns-answer",
          "from": "nameserver",
          "to": "libc",
          "label": "Reply: NOERROR + A record, NXDOMAIN, or nothing",
          "explanation": "A server that holds the zone answers from it. The status tells you which hop failed: no reply (path or server), `SERVFAIL` (server could not get an answer), `NXDOMAIN` (the name does not exist).",
          "reality": {
            "mechanism": "A DNS server process bound to UDP port 53 reads the query, looks the name up in its zone data and returns the record with a TTL. In this lab that server runs on the same host.",
            "observe": [
              {
                "argv": [
                  "ss",
                  "-lunp"
                ],
                "purpose": "Find the processes listening for UDP, including any DNS server on port 53.",
                "look_for": "A socket with local port `53`, its address and process name."
              },
              {
                "argv": [
                  "dig",
                  "+norecurse",
                  "ledger.corp.internal"
                ],
                "purpose": "Ask the configured servers whether they know the answer themselves.",
                "look_for": "`status:` in the header, the `aa` flag and the `ANSWER SECTION`."
              }
            ],
            "artifacts": [
              {
                "kind": "socket",
                "locator": "UDP *:53 (see ss -lunp)",
                "description": "The listening socket of the DNS server that answers queries."
              }
            ]
          }
        },
        {
          "id": "recursion",
          "from": "nameserver",
          "to": "internet",
          "label": "Recursion: root -> TLD -> authoritative",
          "explanation": "On a real network the configured nameserver is usually a recursive resolver: it walks from the root servers to the TLD servers to the zone's authoritative servers, caching each answer for its TTL. `dig +trace` shows this walk. The lab has no internet access, so its server answers `corp.internal` authoritatively and this step does not happen here."
        },
        {
          "id": "connect",
          "from": "libc",
          "to": "app",
          "label": "Addresses returned; application connects",
          "explanation": "getaddrinfo returns the address list; only now does the application open a TCP connection. A failure after this point is not a DNS problem.",
          "reality": {
            "mechanism": "curl tries each returned address with `connect()` on the requested port. Listening TCP sockets show where the service actually runs.",
            "observe": [
              {
                "argv": [
                  "ss",
                  "-ltnp"
                ],
                "purpose": "Find where the HTTP service listens, independent of DNS.",
                "look_for": "The local address and port of the service process."
              },
              {
                "argv": [
                  "curl",
                  "-sv",
                  "--max-time",
                  "5",
                  "http://ledger.corp.internal:9093/readyz"
                ],
                "purpose": "Verify the whole path end to end after a fix.",
                "look_for": "`Trying <address>:9093`, `Connected`, and HTTP 200."
              }
            ]
          }
        }
      ]
    }
  }
}
